{
  "format_version": 1,
  "panel_id": "12-3-nq1v1",
  "panel_serial": "unknown-or-real-serial",
  "profile_name": "12-3-nq1v1-initial-code-domain-seed",
  "created_utc": "2026-05-22T00:00:00Z",
  "target_white": {
    "name": "D65",
    "x": 0.3127,
    "y": 0.3290
  },
  "calibration_condition": {
    "pattern": "100_percent_full_field_white",
    "brightness_percent": 100,
    "local_dimming": "enabled",
    "vision_boost": "not_present",
    "backlight_temp_c": null
  },
  "fpga": {
    "register_map": "wp_adjust_scalar_v1",
    "gain_format": "Q4.12",
    "frac_bits": 12,
    "unity_hex": "0x1000"
  },
  "gains": {
    "r": 3865,
    "g": 4096,
    "b": 3779
  },
  "gain_metadata": {
    "assumed_gamma": 2.184,
    "code_domain_float": {
      "r": 0.9437,
      "g": 1.0,
      "b": 0.9226
    },
    "q_format_hex": {
      "r": "0x0F19",
      "g": "0x1000",
      "b": "0x0EC3"
    }
  },
  "offsets": {
    "enabled": false,
    "r": 0,
    "g": 0,
    "b": 0
  },
  "verification": {
    "initial_xyY": {
      "x": 0.310072,
      "y": 0.308795,
      "Y": null
    },
    "final_xyY": null,
    "inside_report_card_tolerance": null,
    "xy_distance_to_d65": null,
    "converged": false
  },
  "notes": [
    "Initial seed from measured 12.3-nq1v1 white point.",
    "The integer gains are authoritative for the v1 loader; metadata floats document the host/wp_math.py solver-derived code-domain seed.",
    "Use as a starting point only; final calibration should be measurement-driven on the actual display."
  ]
}
